{
  "version": "1.0",
  "type": "structured_workout",
  "metadata": {
    "created": "2026-04-24T00:00:00.000Z",
    "sport": "cycling"
  },
  "extensions": {
    "structured_workout": {
      "name": "Focus Management Test",
      "sport": "cycling",
      "steps": [
        {
          "id": "550e8400-e29b-41d4-a716-446655440000",
          "repeatCount": 2,
          "name": "2x Interval Set",
          "steps": [
            {
              "stepIndex": 0,
              "name": "Block step A — Z3 tempo",
              "durationType": "time",
              "duration": { "type": "time", "seconds": 240 },
              "targetType": "power",
              "target": {
                "type": "power",
                "value": { "unit": "watts", "value": 230 }
              },
              "intensity": "active"
            },
            {
              "stepIndex": 1,
              "name": "Block step B — Z3 recover",
              "durationType": "time",
              "duration": { "type": "time", "seconds": 120 },
              "targetType": "power",
              "target": {
                "type": "power",
                "value": { "unit": "watts", "value": 140 }
              },
              "intensity": "recovery"
            }
          ]
        },
        {
          "stepIndex": 2,
          "name": "Warm-up 10 min",
          "durationType": "time",
          "duration": { "type": "time", "seconds": 600 },
          "targetType": "power",
          "target": {
            "type": "power",
            "value": { "unit": "watts", "value": 100 }
          },
          "intensity": "warmup"
        },
        {
          "stepIndex": 3,
          "name": "Interval 1 — Z4 push",
          "durationType": "time",
          "duration": { "type": "time", "seconds": 300 },
          "targetType": "power",
          "target": {
            "type": "power",
            "value": { "unit": "watts", "value": 280 }
          },
          "intensity": "active"
        },
        {
          "stepIndex": 4,
          "name": "Recovery 1 min",
          "durationType": "time",
          "duration": { "type": "time", "seconds": 60 },
          "targetType": "power",
          "target": {
            "type": "power",
            "value": { "unit": "watts", "value": 120 }
          },
          "intensity": "recovery"
        },
        {
          "stepIndex": 5,
          "name": "Interval 2 — Z4 hold",
          "durationType": "time",
          "duration": { "type": "time", "seconds": 300 },
          "targetType": "power",
          "target": {
            "type": "power",
            "value": { "unit": "watts", "value": 275 }
          },
          "intensity": "active"
        },
        {
          "stepIndex": 6,
          "name": "Cooldown 5 min",
          "durationType": "time",
          "duration": { "type": "time", "seconds": 300 },
          "targetType": "power",
          "target": {
            "type": "power",
            "value": { "unit": "watts", "value": 90 }
          },
          "intensity": "cooldown"
        }
      ]
    }
  }
}
